{
   "bookmarklet" : 0,
   "conversation" : [
      {
         "label" : "Becca Moody:",
         "name" : "Becca Moody",
         "phrase" : "There is no right or wrong, dad, just the consequences of your actions. You taught me that."
      },
      {
         "label" : "Hank Moody:",
         "name" : "Hank Moody",
         "phrase" : "I guess I don't like the consequences of my actions very much right now."
      },
      {
         "label" : "Becca:",
         "name" : "Becca",
         "phrase" : "Yeah. Me neither."
      },
      {
         "label" : "",
         "name" : "",
         "phrase" : "[pause]"
      },
      {
         "label" : "Hank:",
         "name" : "Hank",
         "phrase" : "So, uh ... what is it that you like so much about this boy?"
      },
      {
         "label" : "Becca:",
         "name" : "Becca",
         "phrase" : "I don't know."
      },
      {
         "label" : "Hank:",
         "name" : "Hank",
         "phrase" : "Come on. It's got to be something. Use your words."
      },
      {
         "label" : "Becca:",
         "name" : "Becca",
         "phrase" : "He's really smart."
      },
      {
         "label" : "Hank:",
         "name" : "Hank",
         "phrase" : "Oh. Let's not go crazy."
      },
      {
         "label" : "Becca:",
         "name" : "Becca",
         "phrase" : "[slight embarrassment] And he makes me feel pretty."
      },
      {
         "label" : "Hank:",
         "name" : "Hank",
         "phrase" : "Well, that you are. You're very pretty. You're beautiful."
      },
      {
         "label" : "Becca:",
         "name" : "Becca",
         "phrase" : "Shut up. I'm not beautiful."
      },
      {
         "label" : "Hank:",
         "name" : "Hank",
         "phrase" : "Don't say that. Look. Don't ever say that, you are BEAUTIFUL, you are the most beautiful thing in the world to me."
      },
      {
         "label" : "Becca:",
         "name" : "Becca",
         "phrase" : "[annoyed] Then treat me that way. [voice breaking] I'm ALWAYS on your side, dad, always. Even when I shouldn't be. But I'm sick of it. Get your shit together before it's too late. I don't CARE if you and mom never say another kind word to each other, but I'm sick and tired of parenting you both. <em>I'm a fucking kid</em>, I don't know what I'm doing half the time. But I do know this -- if you keep cracking jokes and taking another drink and pretending that life is one big, stupid party, you will miss everything."
      }
   ],
   "conversation-text" : "Becca Moody: There is no right or wrong, dad, just the consequences of your actions. You taught me that.\nHank Moody: I guess I don't like the consequences of my actions very much right now.\nBecca:  Yeah. Me neither.\n[pause]\nHank: So, uh ... what is it that you like so much about this boy?\nBecca: I don't know.\nHank: Come on. It's got to be something. Use your words.\nBecca: He's really smart.\nHank: Oh. Let's not go crazy.\nBecca: [slight embarrassment] And he makes me feel pretty.\nHank: Well, that you are. You're very pretty. You're beautiful.\nBecca: Shut up. I'm not beautiful.\nHank: Don't say that. Look. Don't ever say that, you are BEAUTIFUL, you are the most beautiful thing in the world to me.\nBecca: [annoyed] Then treat me that way. [voice breaking] I'm ALWAYS on your side, dad, always. Even when I shouldn't be. But I'm sick of it. Get your shit together before it's too late. I don't CARE if you and mom never say another kind word to each other, but I'm sick and tired of parenting you both. <em>I'm a fucking kid</em>, I don't know what I'm doing half the time. But I do know this -- if you keep cracking jokes and taking another drink and pretending that life is one big, stupid party, you will miss everything.",
   "conversation-title" : "Then treat me that way",
   "date" : "Thu, 14 May 2015 17:29:54",
   "date-gmt" : "2015-05-14 21:29:54 GMT",
   "feed-item" : "",
   "format" : "html",
   "from-feed-id" : 0,
   "id" : "118973659604",
   "is-submission" : false,
   "like-button" : "<div class=\"like_button\" data-post-id=\"118973659604\" data-blog-name=\"mrvaidya\" id=\"like_button_118973659604\"><iframe id=\"like_iframe_118973659604\" src=\"http://assets.tumblr.com/assets/html/like_iframe.html?_v=662afb16c40c53f44feaf453f106a197#name=mrvaidya&amp;post_id=118973659604&amp;color=black&amp;rk=fis2UAGq\" scrolling=\"no\" width=\"20\" height=\"20\" frameborder=\"0\" class=\"like_toggle\" allowTransparency=\"true\" name=\"like_iframe_118973659604\"></iframe></div>",
   "mobile" : 0,
   "reblog-button" : "<a href=\"https://www.tumblr.com/reblog/118973659604/fis2UAGq\" class=\"reblog_button\"style=\"display: block;width:20px;height:20px;\"><svg width=\"100%\" height=\"100%\" viewBox=\"0 0 21 21\" xmlns=\"http://www.w3.org/2000/svg\" xmlns:xlink=\"http://www.w3.org/1999/xlink\" fill=\"#ccc\"><path d=\"M5.01092527,5.99908429 L16.0088498,5.99908429 L16.136,9.508 L20.836,4.752 L16.136,0.083 L16.1360004,3.01110845 L2.09985349,3.01110845 C1.50585349,3.01110845 0.979248041,3.44726568 0.979248041,4.45007306 L0.979248041,10.9999998 L3.98376463,8.30993634 L3.98376463,6.89801007 C3.98376463,6.20867902 4.71892527,5.99908429 5.01092527,5.99908429 Z\"></path><path d=\"M17.1420002,13.2800293 C17.1420002,13.5720293 17.022957,14.0490723 16.730957,14.0490723 L4.92919922,14.0490723 L4.92919922,11 L0.5,15.806 L4.92919922,20.5103758 L5.00469971,16.9990234 L18.9700928,16.9990234 C19.5640928,16.9990234 19.9453125,16.4010001 19.9453125,15.8060001 L19.9453125,9.5324707 L17.142,12.203\"></path></svg></a>",
   "reblog-key" : "fis2UAGq",
   "slug" : "then-treat-me-that-way",
   "tags" : [
      "life",
      "love",
      "family",
      "californication"
   ],
   "type" : "conversation",
   "unix-timestamp" : 1431638994,
   "url" : "http://tumblr.ggvaidya.com/post/118973659604",
   "url-with-slug" : "http://tumblr.ggvaidya.com/post/118973659604/then-treat-me-that-way"
}

